{
  "tipoFormulario": "objetos",
  "Nombre": "Prueba",
  "Apellidos": "Objeto",
  "TipoDeDocumento": "NIF",
  "NumeroDeDocumento": "12345678Z",
  "CorreoElectronico": "objeto@example.com",
  "confirmEmail": "objeto@example.com",
  "Telefono": "612345678",
  "Nacionalidad": "ESPA?A",
  "TipoDeTitulo": "pago-tarjeta-ocasional",
  "FechaPerdida": "2026-05-12",
  "Localizacion": "tren",
  "NUnidadTren": "UT-3010",
  "TipoObjeto": "Cartera",
  "Descripcion": "Cartera perdida durante el trayecto.",
  "Observaciones": "Ejemplo migrado a nombres internos SharePoint.",
  "consentimiento": true
}
